{
  "fixed_test_run_id": "fullchain_price_volume_trend_liquidity_improvement_core_20260422_100611",
  "run_id": "fullchain_price_volume_trend_liquidity_improvement_core_20260422_100611",
  "attempt_id": "attempt_20260422_100724",
  "generated_at": "2026-04-22T10:13:20.338705+08:00",
  "candidate_scheme_id": "price_volume_v15_trend_liquidity_improvement_core",
  "research_round_id": "rr_price_volume_trend_liquidity_improvement_family_20260422",
  "warnings": [
    "execution_path_daily contains unresolved or unpriced rows.",
    "terminal_event_daily is present but partially degraded in the shared source."
  ],
  "fatal_blockers": [],
  "ranking_anomaly_rows": 0,
  "unfilled_topk_count": 1520,
  "terminal_event_degraded_rows": 314,
  "benchmark_fallback_triggered": false,
  "low_liquidity_flag_high": false,
  "topk_perturbation_pass": false,
  "cost_stress_pass": false,
  "cost_stress_annual_relative_return": -0.09624860203539798,
  "exposure_driven_or_liquidity_driven": false,
  "notes": [
    "Low-liquidity exposure flag uses a heuristic threshold on weight share and alpha contribution share.",
    "Audit summary is a near-formal scaffold and still excludes full exposure attribution.",
    "All fixed-test return fields use decimal-return convention unless explicitly labeled otherwise."
  ]
}
