{
  "fixed_test_run_id": "confirmatory_fixed_test_vsumd60_seed_linear_rank_decay_trainval_20260429",
  "run_id": "confirmatory_vsumd60_seed_linear_rank_decay_trainval_20260429",
  "attempt_id": "attempt_20260429_173136",
  "generated_at": "2026-04-29T17:34:27.248343+08:00",
  "candidate_scheme_id": "confirmatory_alpha158_vsumd60_seed_linear_rank_decay_v1",
  "research_round_id": "rr_confirmatory_alpha158_vsumd60_family_seed_head_extraction_20260429",
  "warnings": [
    "execution_path_daily contains unresolved or unpriced rows.",
    "ranking_eligible_D0 rows with missing or nonfinite model_score_D0 were excluded from TopK.",
    "terminal_event_daily is present but partially degraded in the shared source."
  ],
  "fatal_blockers": [],
  "ranking_anomaly_rows": 907,
  "unfilled_topk_count": 1062,
  "terminal_event_degraded_rows": 144,
  "benchmark_fallback_triggered": false,
  "low_liquidity_flag_high": false,
  "topk_perturbation_pass": false,
  "cost_stress_pass": false,
  "cost_stress_annual_relative_return": -0.09691075239335034,
  "exposure_driven_or_liquidity_driven": false,
  "notes": [
    "Low-liquidity exposure flag uses a heuristic threshold on weight share and alpha contribution share.",
    "Audit summary is a near-formal scaffold and still excludes full exposure attribution.",
    "All fixed-test return fields use decimal-return convention unless explicitly labeled otherwise."
  ]
}
