{
  "fixed_test_run_id": "exploratory_intraday_c3_20260501",
  "run_id": "exploratory_intraday_c3_20260501",
  "attempt_id": "attempt_20260501_111214",
  "generated_at": "2026-05-01T11:17:15.124007+08:00",
  "candidate_scheme_id": "exploratory_intraday_c3_trendbias_upsideshare_reversalasym",
  "research_round_id": "rr_exploratory_intraday_microstructure_independent_baseline_20260501",
  "warnings": [
    "ranking_eligible_D0 rows with missing or nonfinite model_score_D0 were excluded from TopK."
  ],
  "fatal_blockers": [],
  "ranking_anomaly_rows": 3658,
  "unfilled_topk_count": 1396,
  "terminal_event_degraded_rows": null,
  "benchmark_fallback_triggered": false,
  "low_liquidity_flag_high": false,
  "topk_perturbation_pass": false,
  "cost_stress_pass": false,
  "cost_stress_annual_relative_return": -0.10306304372131891,
  "exposure_driven_or_liquidity_driven": false,
  "notes": [
    "Low-liquidity exposure flag uses a heuristic threshold on weight share and alpha contribution share.",
    "Audit summary is a near-formal scaffold and still excludes full exposure attribution.",
    "All fixed-test return fields use decimal-return convention unless explicitly labeled otherwise."
  ]
}
