{
  "fixed_test_run_id": "diag_oracle_5d_return",
  "run_id": "diag_oracle_5d_return",
  "attempt_id": "attempt_20260502_002223",
  "generated_at": "2026-05-02T00:24:54.566059+08:00",
  "candidate_scheme_id": "diag_oracle_5d_return",
  "research_round_id": "diag_perfect_foresight_stress_probe_20260501",
  "warnings": [
    "ranking_eligible_D0 rows with missing or nonfinite model_score_D0 were excluded from TopK."
  ],
  "fatal_blockers": [],
  "ranking_anomaly_rows": 176397,
  "unfilled_topk_count": 2812,
  "terminal_event_degraded_rows": null,
  "benchmark_fallback_triggered": false,
  "low_liquidity_flag_high": false,
  "topk_perturbation_pass": true,
  "cost_stress_pass": true,
  "cost_stress_annual_relative_return": 332.3026587359042,
  "exposure_driven_or_liquidity_driven": false,
  "notes": [
    "Low-liquidity exposure flag uses a heuristic threshold on weight share and alpha contribution share.",
    "Audit summary is a near-formal scaffold and still excludes full exposure attribution.",
    "All fixed-test return fields use decimal-return convention unless explicitly labeled otherwise."
  ]
}
