{
  "fixed_test_run_id": "fullchain_baseline_broadened_head_extraction_20260418_2315",
  "run_id": "fullchain_baseline_broadened_head_extraction_20260418_2315",
  "attempt_id": "attempt_20260418_232405",
  "generated_at": "2026-04-18T23:29:37.989738+08:00",
  "candidate_scheme_id": "baseline_momentum_v10_broadened_head_extraction",
  "research_round_id": "rr_baseline_broadened_head_extraction_20260418",
  "warnings": [
    "execution_path_daily contains unresolved or unpriced rows.",
    "ranking_eligibility_guard excluded rows from the ranking universe before TopK freeze.",
    "ranking_eligible_D0 rows with missing or nonfinite model_score_D0 were excluded from TopK.",
    "terminal_event_daily is present but partially degraded in the shared source."
  ],
  "fatal_blockers": [],
  "ranking_anomaly_rows": 135887,
  "unfilled_topk_count": 1164,
  "terminal_event_degraded_rows": 314,
  "benchmark_fallback_triggered": false,
  "low_liquidity_flag_high": false,
  "topk_perturbation_pass": false,
  "cost_stress_pass": false,
  "cost_stress_annual_relative_return": -0.11961808347589542,
  "exposure_driven_or_liquidity_driven": false,
  "notes": [
    "Low-liquidity exposure flag uses a heuristic threshold on weight share and alpha contribution share.",
    "Audit summary is a near-formal scaffold and still excludes full exposure attribution.",
    "All fixed-test return fields use decimal-return convention unless explicitly labeled otherwise."
  ]
}
