{
  "fixed_test_run_id": "fullchain_challenger_drop_lowvol_20260418_0745",
  "run_id": "fullchain_challenger_drop_lowvol_20260418_0745",
  "attempt_id": "attempt_challenger_drop_lowvol_20260418_0915",
  "generated_at": "2026-04-18T11:18:40.993605+08:00",
  "candidate_scheme_id": "baseline_reversal_momentum_v3",
  "research_round_id": "rr_baseline_challenger_drop_lowvol_20260418",
  "warnings": [
    "execution_path_daily contains unresolved or unpriced rows.",
    "ranking_eligible_D0 rows with missing or nonfinite model_score_D0 were excluded from TopK.",
    "terminal_event_daily is present but partially degraded in the shared source."
  ],
  "fatal_blockers": [],
  "ranking_anomaly_rows": 135887,
  "unfilled_topk_count": 3722,
  "terminal_event_degraded_rows": 314,
  "benchmark_fallback_triggered": false,
  "low_liquidity_flag_high": true,
  "topk_perturbation_pass": false,
  "cost_stress_pass": false,
  "cost_stress_annual_relative_return": -0.18093752308128952,
  "exposure_driven_or_liquidity_driven": true,
  "notes": [
    "Low-liquidity exposure flag uses a heuristic threshold on weight share and alpha contribution share.",
    "Audit summary is a near-formal scaffold and still excludes full exposure attribution."
  ]
}
